,productId,date,seller,price,link,name
0,13263,2023-04-27,yeppeuda,360,https://yeppeuda.mk/p/395/anti-cellulite-body-lotion-150ml,Anti cellulite body lotion 150ml
1,13057,2023-04-27,coslovemetics,1192,https://coslovemetics.mk/product/benton-ceramide-cream-10-000ppm-80ml/,Benton Ceramide Cream 10.000PPM 80ml
2,13362,2023-04-27,yeppeuda,770,https://yeppeuda.mk/p/480/probiotic-moisturizing-soothing-shower-gel-250ml-for-kids,PROBIOTIC MOISTURIZING - SOOTHING SHOWER GEL 250ML FOR KIDS
3,13119,2023-04-27,coslovemetics,510,https://coslovemetics.mk/product/innisfree-blueberry-rebalancing-5-5-cleanser-100ml/,innisfree Blueberry Rebalancing 5.5 Cleanser 100ml
4,13346,2023-04-27,yeppeuda,690,https://yeppeuda.mk/p/376/mousse-shampoo-for-low-porosity-hair-200-ml,Mousse shampoo for low porosity hair 200 ml
5,12981,2023-04-27,coslovemetics,239,https://coslovemetics.mk/product/fluff-sorbet-hand-cream-juicy-watermelon-50ml/,Fluff Sorbet Hand Cream Juicy Watermelon 50ml
6,13163,2023-04-27,coslovemetics,899,https://coslovemetics.mk/product/1/,AXIS-Y Sunday Morning Refreshing Cleansing Foam 120ml
7,13357,2023-04-27,yeppeuda,590,https://yeppeuda.mk/p/485/moisturizing-mousse-for-tummy-skin-100ml-for-mom,MOISTURIZING MOUSSE FOR TUMMY SKIN 100ML FOR MOM
8,13120,2023-04-27,coslovemetics,1384,https://coslovemetics.mk/product/innisfree-jeju-cherry-blosom-jelly-cream-50ml-2/,Innisfree Jeju Cherry Blosom Jelly Cream 50ml
9,12788,2023-04-27,coslovemetics,1197,https://coslovemetics.mk/product/purito-centella-unscented-recovery-cream/,PURITO Centella Unscented Recovery Cream
10,13397,2023-04-27,yeppeuda,1290,https://yeppeuda.mk/p/140/ginseng-essence-water-beauty-of-joseon-150ml,Ginseng Essence Water Beauty of Joseon 150ml
11,12946,2023-04-27,coslovemetics,589,https://coslovemetics.mk/product/unleashia-pretty-easy-glitter-stick-n8-nudy-morn/,Unleashia Pretty Easy Glitter Stick N°8 Nudy Morn
12,12770,2023-04-27,coslovemetics,1197,https://coslovemetics.mk/product/purito-centella-green-buffet-serum/,PURITO Centella Green Buffet Serum
13,12798,2023-04-27,coslovemetics,1473,https://coslovemetics.mk/product/purito-daily-soft-touch-sunscreen-60ml/,PURITO Daily Soft Touch Sunscreen 60ml
14,13128,2023-04-27,coslovemetics,1120,https://coslovemetics.mk/product/tocobo-multi-ceramide-cream-50ml/,TOCOBO Multi Ceramide Cream 50ml
15,12737,2023-04-27,coslovemetics,1131,https://coslovemetics.mk/product/missha-perfect-covering-spf50-pa-bb-cream-22-beige-40ml/,Missha Perfect Covering SPF50 PA+++ BB Cream 22 Beige 40ml
16,13176,2023-04-27,coslovemetics,623,https://coslovemetics.mk/product/enough-collagen-3in1-cream-50gr/,ENOUGH Collagen 3in1 Cream 50gr
17,13342,2023-04-27,yeppeuda,590,https://yeppeuda.mk/p/381/serum-for-high-porosity-hair-40ml,Serum for high porosity hair 40ml
18,12617,2023-04-27,coslovemetics,296,https://coslovemetics.mk/product/cosrx-ac-collection-acne-patch-26ea-3-%d0%b2%d0%b5%d0%bb%d0%b8%d1%87%d0%b8%d0%bd%d0%b8/,COSRX AC Collection Acne Patch 26ea (3 величини)
19,12584,2023-04-27,coslovemetics,798,https://coslovemetics.mk/product/pyunkang-yul-ato-mild-sun-cream-spf-45-pa-75ml/,Pyunkang Yul ATO Mild Sun Cream SPF 50 PA++++ 75ml
20,12765,2023-04-27,coslovemetics,560,https://coslovemetics.mk/product/purito-all-care-recovery-cica-aid/,PURITO All Care Recovery Cica-Aid
21,12694,2023-04-27,coslovemetics,1412,https://coslovemetics.mk/product/marymay-idebenone-blackberry-complex-intensive-cream-70g/,Mary&May Idebenone + Blackberry Complex Intensive Cream 70g
22,12810,2023-04-27,coslovemetics,928,https://coslovemetics.mk/product/some-by-mi-aha-bha-pha-30-days-miracle-toner-150ml/,Some by mi AHA-BHA-PHA 30 days Miracle Toner 150ml
23,12852,2023-04-27,coslovemetics,799,https://coslovemetics.mk/product/eyenlip-black-snail-all-in-one-cream-100ml/,EYENLIP Black Snail All In One Cream 100ml
24,12861,2023-04-27,coslovemetics,53,https://coslovemetics.mk/product/eyenlip-moisture-essence-mask-milk-1pcs/,EYENLIP Moisture Essence Mask Milk 1pcs
25,13325,2023-04-27,yeppeuda,360,https://yeppeuda.mk/p/194/ghassoul-clay-94gr,Ghassoul Clay 94gr
26,13225,2023-04-27,yeppeuda,540,https://yeppeuda.mk/p/477/body-wash-and-shampoo-for-kids-and-babies,Body wash and shampoo for kids and babies
27,13046,2023-04-27,yeppeuda,1190,https://yeppeuda.mk/p/403/vita-a-bakuchiol-youth-serum-40ml,Vita A Bakuchiol Youth Serum 40ml
28,12942,2023-04-27,coslovemetics,589,https://coslovemetics.mk/product/unleashia-pretty-easy-glitter-stick-n3-brave/,Unleashia Pretty Easy Glitter Stick N°3 Brave
29,12715,2023-04-27,coslovemetics,891,https://coslovemetics.mk/product/isntree-hyaluronic-acid-toner-200ml/,Isntree Hyaluronic Acid Toner 200ml
30,12913,2023-04-27,coslovemetics,779,https://coslovemetics.mk/product/unleashia-tap-me-palette-duo-n3-rub-a-dub/,Unleashia Tap Me Palette Duo N°3 Rub-A-Dub
31,12927,2023-04-27,coslovemetics,1349,https://coslovemetics.mk/product/unleashia-healthy-green-cushion-spf30-pa-18/,Unleashia Healthy Green Cushion SPF30 PA++ #18
32,12944,2023-04-27,coslovemetics,589,https://coslovemetics.mk/product/unleashia-pretty-easy-glitter-stick-n6-wee-hours/,Unleashia Pretty Easy Glitter Stick N°6 Wee Hours
33,13272,2023-04-27,yeppeuda,790,https://yeppeuda.mk/p/344/nacomi-next-level-serum-azeloglycine-5-30ml,Nacomi Next Level Serum Azeloglycine 5% 30ml
34,13403,2023-04-27,yeppeuda,330,https://yeppeuda.mk/p/153/frudia-my-orchard-dragon-fruit-hand-cream-30gr,Frudia My Orchard Dragon Fruit Hand Cream 30gr
35,13090,2023-04-27,coslovemetics,579,https://coslovemetics.mk/product/iunik-propolis-vitamin-eye-cream-for-eyeface-30ml/,iUNIK Propolis Vitamin Eye Cream For Eye&Face 30ml
36,12749,2023-04-27,yeppeuda,690,https://yeppeuda.mk/p/456/all-clean-balm-mandarin-50ml,All Clean Balm Mandarin 50ml
37,12887,2023-04-27,coslovemetics,737,https://coslovemetics.mk/product/eyenlip-deep-hyaluron8-ampoule-cream-50ml/,EYENLIP DEEP HYALURON8 AMPOULE CREAM 50ml
38,12627,2023-04-27,coslovemetics,842,https://coslovemetics.mk/product/cosrx-aloe-54-2-aqua-tone-up-sunscreen-spf-50-pa/,COSRX Aloe 54.2 Aqua Tone-Up Sunscreen SPF 50+/ PA++++
39,12980,2023-04-27,coslovemetics,615,https://coslovemetics.mk/product/fluff-smoothing-body-cloud-150g/,Fluff Smoothing Body Cloud 150g
40,13224,2023-04-27,yeppeuda,3990,https://yeppeuda.mk/p/478/omi-facial-massager-cleanser-brush,OMI facial massager cleanser brush
41,13231,2023-04-27,yeppeuda,680,https://yeppeuda.mk/p/471/face-and-lip-scrub-orange-80gr,Face and lip scrub orange 80gr
42,13264,2023-04-27,yeppeuda,800,https://yeppeuda.mk/p/394/regenerating-after-sun-body-butter-150ml,Regenerating after sun body butter 150ml
43,13043,2023-04-27,coslovemetics,837,https://coslovemetics.mk/product/tiam-snail-azulene-water-essence-180ml/,TIAM Snail & Azulene Water Essence 180ml
44,13130,2023-04-27,coslovemetics,1071,https://coslovemetics.mk/product/tocobo-bio-watery-sun-cream-spf50-pa-50-ml/,TOCOBO Bio Watery Sun Cream SPF50+ PA++++ 50 ml
45,13030,2023-04-27,coslovemetics,839,https://coslovemetics.mk/product/tiam-ac-fighting-pha-12-purifying-liquid-80ml/,TIAM AC Fighting PHA 12 Purifying Liquid 80ml
46,13031,2023-04-27,coslovemetics,945,https://coslovemetics.mk/product/tiam-ac-fighting-spot-rx-cream-30gr/,TIAM AC Fighting Spot Rx Cream 30gr
47,13250,2023-04-27,yeppeuda,660,https://yeppeuda.mk/p/415/collagen-face-cream-50ml,Collagen face cream 50ml
48,12639,2023-04-27,coslovemetics,1272,https://coslovemetics.mk/product/cosrx-balancium-ceramide-lip-butter-sleeping-mask-20gr/,COSRX Balancium Ceramide Lip Butter Sleeping Mask 20gr
49,12638,2023-04-27,coslovemetics,1099,https://coslovemetics.mk/product/cosrx-vitamin-e-vitalizing-sunscreen-spf-50-50ml/,COSRX Vitamin E Vitalizing Sunscreen SPF 50+ 50ml
50,13206,2023-04-27,coslovemetics,333,https://coslovemetics.mk/product/one-thing-centella-asiatica-extract-40ml/,One Thing Centella Asiatica Extract 40ml
51,13234,2023-04-27,yeppeuda,690,https://yeppeuda.mk/p/461/daily-moisturizing-and-balancing-toner-100ml,Daily moisturizing and balancing toner 100ml
52,12685,2023-04-27,coslovemetics,1368,https://coslovemetics.mk/product/marymay-vegan-peptide-bakuchiol-sun-stick-spf50-pa-18g/,Mary&May Vegan Peptide Bakuchiol Sun Stick SPF50+ PA++++ 18g
53,12745,2023-04-27,coslovemetics,1190,https://coslovemetics.mk/product/heimish-moringa-ceramide-bb-cream-spf-30-pa23n-light-medium/,Heimish Moringa Ceramide BB Cream SPF 30 PA++23N Light Medium
54,13158,2023-04-27,coslovemetics,1399,https://coslovemetics.mk/product/complete-no-stress-physical-sunscreen-spf-50-pa-50ml/,AXIS-Y Complete No-Stress Physical Sunscreen SPF 50+ PA ++++ 50ml
55,12931,2023-04-27,coslovemetics,830,https://coslovemetics.mk/product/unleashia-healthy-green-cushion-spf30-pa-21-refill/,Unleashia Healthy Green Cushion SPF30 PA #21 – refill
56,13019,2023-04-27,coslovemetics,509,https://coslovemetics.mk/product/farm-stay-hyaluronic-uv-shield-sun-block-cream-spf50-pa-70g/,FARM STAY Hyaluronic UV Shield Sun Block Cream SPF50+ PA+++ 70g
57,13127,2023-04-27,yeppeuda,750,https://yeppeuda.mk/p/368/coconut-clay-cleansing-foam-150ml-tocobo,Coconut Clay Cleansing Foam 150ml Tocobo
58,13037,2023-04-27,coslovemetics,774,https://coslovemetics.mk/product/tiam-vita-b5-toner-180ml/,TIAM My Signiture Vita B5 Toner NEW 180ml
59,13339,2023-04-27,yeppeuda,570,https://yeppeuda.mk/p/384/hot-oil-treatment-for-medium-porosity-hair-100ml,Hot oil treatment for medium porosity hair 100ml
60,12628,2023-04-27,coslovemetics,846,https://coslovemetics.mk/product/cosrx-aloe-soothing-sun-cream-50ml/,COSRX Aloe Soothing Sun Cream 50ml
61,12643,2023-04-27,coslovemetics,1136,https://coslovemetics.mk/product/cosrx-bha-blackhead-power-liquid-100ml/,COSRX BHA Blackhead Power Liquid 100ml
62,12693,2023-04-27,coslovemetics,1108,https://coslovemetics.mk/product/marymay-hyaluronic-panthenol-hydra-mask30/,Mary&May Hyaluronic Panthenol Hydra Mask (30 лист маски)
63,13140,2023-04-27,coslovemetics,203,https://coslovemetics.mk/product/etude-house-drawing-eye-brow-0-25g-3-brown/,ETUDE HOUSE Drawing Eye Brow 0.25g #3 Brown
64,13084,2023-04-27,coslovemetics,809,https://coslovemetics.mk/product/iunik-centella-bubble-cleansing-foam-150ml/,iUNIK Centella Bubble Cleansing Foam 150ml
65,12771,2023-04-27,coslovemetics,1135,https://coslovemetics.mk/product/purito-centella-green-level-calming-toner/,PURITO Centella Green Level Calming Toner
66,13122,2023-04-27,coslovemetics,712,https://coslovemetics.mk/product/innisfree-jeju-volcanic-pore-clay-mask-100ml/,Innisfree Jeju Volcanic Pore Clay Mask 100ml
67,13161,2023-04-27,coslovemetics,1259,https://coslovemetics.mk/product/heartleaf-my-type-calming-cream-60ml/,AXIS-Y Heartleaf My Type Calming Cream 60ml
68,13208,2023-04-27,coslovemetics,959,https://coslovemetics.mk/product/one-thing-centella-soothing-cream-100ml/,One Thing Centella Soothing Cream 100ml
69,13409,2023-04-27,yeppeuda,1190,https://yeppeuda.mk/p/364/im-safe-for-sensitive-skin-sunscreen-spf35-pa,I'm Safe For Sensitive Skin Sunscreen SPF35 PA+++
70,13246,2023-04-27,yeppeuda,660,https://yeppeuda.mk/p/439/light-body-butter-for-pregnant-women-100-ml,Light body butter for pregnant women 100 ml
71,12785,2023-04-27,coslovemetics,1416,https://coslovemetics.mk/product/purito-oat-in-silky-toner-200ml/,PURITO Oat-in Silky Toner 200ml
72,12610,2023-04-27,coslovemetics,1553,https://coslovemetics.mk/product/pyunkang-yul-nutrition-cream-100ml/,Pyunkang Yul Nutrition Cream 100ml
73,12679,2023-04-27,coslovemetics,466,https://coslovemetics.mk/product/marymay-rose-hyaluronic-hydra-wash-off-pack-30g/,Mary&May Rose Hyaluronic Hydra Wash off Pack 30g
74,13075,2023-04-27,coslovemetics,425,https://coslovemetics.mk/product/sensitive-skin-%d0%bc%d0%b0%d1%81%d1%82-%d0%b7%d0%b0-%d0%b7%d0%b0%d1%88%d1%82%d0%b8%d1%82%d0%b0-%d0%bd%d0%b0-%d1%81%d0%b5%d0%bd%d0%b7%d0%b8%d1%82%d0%b8%d0%b2%d0%bd%d0%b0-%d0%ba%d0%be%d0%b6%d0%b0/,Sensitive Skin Маст за заштита на сензитивна кожа збогатена со овес (75мл)
75,13142,2023-04-27,coslovemetics,359,https://coslovemetics.mk/product/etude-house-dear-darling-water-gel-tint-ice-cream-shark-red-4-5g/,ETUDE HOUSE Dear Darling Water Gel Tint Ice Cream Shark Red 4.5g
76,13295,2023-04-27,yeppeuda,499,https://yeppeuda.mk/p/267/magic-dust-face-cleansing-brightening-powder-20gr,Magic Dust - Face Cleansing & Brightening Powder 20gr
77,13144,2023-04-27,coslovemetics,144,https://coslovemetics.mk/product/etude-house-brightening-eye-patch/,Etude House Brightening Eye Patch
78,13377,2023-04-27,yeppeuda,420,https://yeppeuda.mk/p/327/anti-acne-concealing-cover-stick-ivory,ANTI ACNE Concealing cover stick ivory
79,12968,2023-04-27,coslovemetics,703,https://coslovemetics.mk/product/fluff-moisturizing-face-cream-cream-cloud-50ml/,Fluff Moisturizing face cream Cream Cloud 50ml
80,12711,2023-04-27,yeppeuda,990,https://yeppeuda.mk/p/27/repair-serum-ginseng-snail-mucin,Repair Serum - Ginseng + Snail Mucin
81,13126,2023-04-27,coslovemetics,945,https://coslovemetics.mk/product/tocobo-vita-berry-pore-toner-150ml/,TOCOBO Vita Berry Pore Toner 150ml
82,12976,2023-04-27,coslovemetics,431,https://coslovemetics.mk/product/fluff-shower-gel-kudzu-and-orange-blossom-500ml/,Fluff Shower gel Kudzu and orange blossom 500ml
83,12954,2023-04-27,coslovemetics,599,https://coslovemetics.mk/product/fluff-aloe-and-avocado-booster-two-phase-face-serum-40ml/,Fluff Aloe and avocado Booster/Two-phase Face Serum 40ml
84,13378,2023-04-27,yeppeuda,520,https://yeppeuda.mk/p/326/lid-under-eye-serum-with-eyebright-and-caffeine-15-ml,Lid & under eye serum with eyebright and caffeine - 15 ml
85,13107,2023-04-27,coslovemetics,650,https://coslovemetics.mk/product/geekgorgeous-ha-5-light-hyaluronic-acid-serum-30ml/,Geek&Gorgeous HA 5 Light Hyaluronic Acid Serum 30ml
86,13287,2023-04-27,yeppeuda,810,https://yeppeuda.mk/p/276/anti-acne-face-serum-40ml,Anti - acne face serum 40мл
87,13092,2023-04-27,coslovemetics,899,https://coslovemetics.mk/product/iunik-propolis-vitamin-synergy-serum-50ml/,iUNIK Propolis Vitamin Synergy Serum 50ml
88,12655,2023-04-27,coslovemetics,616,https://coslovemetics.mk/product/cosrx-low-ph-good-morning-gel-cleanser-150ml/,COSRX Low pH Good Morning Gel Cleanser 150ml
89,12613,2023-04-27,coslovemetics,392,https://coslovemetics.mk/product/pyunkang-yul-quick-moisturizing-professional-hand-lotion-50ml/,Pyunkang Yul Quick Moisturizing Professional Hand Lotion 50ml
90,12809,2023-04-27,coslovemetics,987,https://coslovemetics.mk/product/some-by-mi-aha-bha-pha-30-days-miracle-serum-50-ml/,Some by mi AHA-BHA-PHA 30 days Miracle Serum 50 ml
91,13168,2023-04-27,coslovemetics,553,https://coslovemetics.mk/product/skinfood-egg-white-pore-mask-125g/,Skinfood Egg white pore Mask 125g
92,12689,2023-04-27,coslovemetics,1108,https://coslovemetics.mk/product/marymay-collagen-peptide-vital-mask30/,Mary&May Collagen Peptide Vital Mask (30 лист маски)
93,12818,2023-04-27,coslovemetics,85,https://coslovemetics.mk/product/some-by-mi-real-cica-calming-care-mask-1-%d0%bf%d0%b0%d1%80%d1%87%d0%b5/,SOME BY MI Real Cica Calming Care Mask 1 парче
94,12696,2023-04-27,coslovemetics,1416,https://coslovemetics.mk/product/marymay-lemon-niacinamide-glow-wash-off-pack-125g/,Mary&May Lemon Niacinamide Glow Wash off Pack 125g
95,13071,2023-04-27,coslovemetics,590,https://coslovemetics.mk/product/benton-deep-green-tea-cleansing-foam-120g/,BENTON] Deep Green Tea Cleansing Foam 120g
96,13394,2023-04-27,yeppeuda,665,https://yeppeuda.mk/p/90/all-clean-white-clay-foam-150gr,All Clean White Clay Foam 150gr
97,12755,2023-04-27,coslovemetics,545,https://coslovemetics.mk/product/heimish-glow-cheek-antique-berry-4g/,Heimish Glow Cheek Antique Berry 4g
98,12709,2023-04-27,coslovemetics,1059,https://coslovemetics.mk/product/beauty-of-joseon-relief-sun-rice-probiotics-50ml/,Beauty of Joseon Relief Sun Rice + Probiotics 50ml
99,12825,2023-04-27,coslovemetics,694,https://coslovemetics.mk/product/some-by-mi-super-matcha-pore-clean-clay-mask-160gr/,SOME BY MI Super Matcha Pore Clean Clay Mask 100gr
100,13308,2023-04-27,yeppeuda,430,https://yeppeuda.mk/p/252/creme-brulee-body-butter-vanilla-100ml,Crème Brulee Body Butter Vanilla 100ml
101,13312,2023-04-27,yeppeuda,399,https://yeppeuda.mk/p/207/glycolic-acid-serum-10-30-ml,GLYCOLIC ACID SERUM 10% 30 ML
102,13274,2023-04-27,yeppeuda,820,https://yeppeuda.mk/p/342/nacomi-next-level-trehalose-10-multitasking-face-serum-30-ml,Nacomi Next Level - Trehalose 10% - Multitasking face serum - 30 ml
103,12645,2023-04-27,coslovemetics,792,https://coslovemetics.mk/product/cosrx-centella-water-alcohol-free-toner-150ml/,COSRX Centella Water Alcohol-Free Toner 150ml
104,13061,2023-04-27,coslovemetics,640,https://coslovemetics.mk/product/benton-honest-cleansing-foam-150g/,Benton Honest Cleansing Foam 150g
105,13229,2023-04-27,yeppeuda,660,https://yeppeuda.mk/p/473/collagen-face-gel-50ml,Collagen face gel 50ml
106,13293,2023-04-27,yeppeuda,610,https://yeppeuda.mk/p/270/hyaluronic-face-gel-cream-50ml,Hyaluronic Face Gel CREAM 50мл
107,13260,2023-04-27,yeppeuda,690,https://yeppeuda.mk/p/405/milky-face-toner-100ml,Milky face toner 100ml
108,12858,2023-04-27,coslovemetics,719,https://coslovemetics.mk/product/eyenlip-centella-skin-resurrection-serum-60ml/,EYENLIP Centella Skin Resurrection Serum 60ml
109,13390,2023-04-27,yeppeuda,999,https://yeppeuda.mk/p/309/dermo-expert-white-beauty-lightening-acid-peel-night-care-30-ml,DERMO EXPERT® WHITE & BEAUTY® Lightening acid peel night care - 30 ml
110,13157,2023-04-27,coslovemetics,1199,https://coslovemetics.mk/product/axis-y-cera-heart-my-type-duo-cream-60ml/,AXIS-Y Cera-Heart My Type Duo Cream 60ml
111,12573,2023-04-27,coslovemetics,360,https://coslovemetics.mk/product/cp-1-keratin-concentrate-ampoule-10ml/,CP-1 Keratin Concentrate Ampoule 10ml
112,12939,2023-04-27,coslovemetics,1381,https://coslovemetics.mk/product/unleashia-glitterpedia-eye-palette-n7-all-of-peach-ade/,Unleashia Glitterpedia Eye Palette N°7 All of Peach Ade
113,12671,2023-04-27,coslovemetics,1416,https://coslovemetics.mk/product/marymay-cica-tea-tree-soothing-wash-off-pack-125g/,Mary&May CICA Tea Tree Soothing Wash off Pack 125g
114,12994,2023-04-27,coslovemetics,463,https://coslovemetics.mk/product/fluff-h2o-gel-body-hydrating-gel-cucumber-green-tea-150ml/,"Fluff H2o Gel, Body Hydrating Gel cucumber, green tea 150ml"
115,12961,2023-04-27,coslovemetics,431,https://coslovemetics.mk/product/fluff-body-sorbet-frosted-blueberries-150ml/,Fluff Body Sorbet Frosted Blueberries 150ml
116,13275,2023-04-27,yeppeuda,660,https://yeppeuda.mk/p/341/nacomi-next-level-serum-with-5-shikimic-acid-30-ml,Nacomi Next Level - Serum with 5% shikimic acid - 30 ml
117,12729,2023-04-27,coslovemetics,128,https://coslovemetics.mk/product/missha-mascure-peeling-solution-sheet-mask-pha-28ml-1pc/,Missha Mascure Peeling Solution Sheet Mask – (PHA) 28ml – 1pc
118,12665,2023-04-27,coslovemetics,1416,https://coslovemetics.mk/product/marymay-blackberry-complex-glow-washoff-pack-125g/,Mary&May Blackberry Complex Glow Washoff Pack 125g
119,12593,2023-04-27,coslovemetics,680,https://coslovemetics.mk/product/pyunkang-yul-calming-moisture-serum-30ml/,PYUNKANG YUL Calming Moisture Serum 30ml
120,12963,2023-04-27,coslovemetics,423,https://coslovemetics.mk/product/fluff-body-yoghurt-watermelon-180ml/,Fluff Body Yoghurt Watermelon 180ml
121,12650,2023-04-27,coslovemetics,359,https://coslovemetics.mk/product/cosrx-full-fit-propolis-synergy-toner-50ml/,COSRX Full Fit Propolis Synergy Toner 50ml
122,12676,2023-04-27,coslovemetics,708,https://coslovemetics.mk/product/marymay-white-collagen-cleansing-foam-150ml/,Mary&May White Collagen Cleansing Foam 150ml
123,13360,2023-04-27,yeppeuda,760,https://yeppeuda.mk/p/482/normalizing-and-moisturizing-face-cream-50ml-for-mom,NORMALIZING AND MOISTURIZING FACE CREAM 50ML FOR MOM
124,13400,2023-04-27,yeppeuda,690,https://yeppeuda.mk/p/353/frudia-green-grape-sebum-control-cooling-sun-gel,FRUDIA GREEN GRAPE SEBUM CONTROL COOLING SUN GEL
125,12575,2023-04-27,coslovemetics,970,https://coslovemetics.mk/product/cp-1-anti-hair-loss-scalp-infusion-shampoo-250ml/,CP-1 Anti Hair Loss Scalp Infusion Shampoo 250ml
126,12661,2023-04-27,coslovemetics,1352,https://coslovemetics.mk/product/cosrx-pure-fit-cica-serum-30ml/,COSRX Pure Fit Cica Serum 30ml
127,12692,2023-04-27,coslovemetics,1044,https://coslovemetics.mk/product/marymay-houttuynia-cordata-tea-tree-serum-30ml/,Mary&May Houttuynia Cordata +Tea Tree Serum 30ml
128,13410,2023-04-27,yeppeuda,1290,https://yeppeuda.mk/p/359/im-pure-perfect-cica-sunscreen,I’M PURE PERFECT CICA SUNSCREEN
129,12782,2023-04-27,coslovemetics,180,https://coslovemetics.mk/product/purito-from-green-deep-foaming-cleanser-mini-30ml/,PURITO From Green Deep Foaming Cleanser (mini) 30ml
130,13223,2023-04-27,yeppeuda,419,https://yeppeuda.mk/p/490/baby-nappy-cream-50ml,BABY Nappy Cream 50ml
131,13235,2023-04-27,yeppeuda,690,https://yeppeuda.mk/p/460/pore-reducing-toner-100ml,Pore reducing toner 100ml
132,13298,2023-04-27,yeppeuda,820,https://yeppeuda.mk/p/264/cleansing-oil-ocm-makeup-remover-for-normal-and-dry-skin-150ml,Cleansing Oil - OCM makeup remover for normal and dry skin 150ml
133,12985,2023-04-27,coslovemetics,559,https://coslovemetics.mk/product/fluff-watermelon-day-care-gel-50ml/,Fluff Watermelon Day Care Gel 50ml
134,13381,2023-04-27,yeppeuda,620,https://yeppeuda.mk/p/323/mild-face-cleasing-gel-for-sensitive-skin-150-ml,Mild face cleasing gel for sensitive skin - 150 ml
135,12762,2023-04-27,yeppeuda,1996,https://yeppeuda.mk/p/57/marine-eye-cream-30ml,Marine Eye Cream 30ml
136,13269,2023-04-27,yeppeuda,1160,https://yeppeuda.mk/p/389/skin-color-correcting-serum-30ml,Skin Color Correcting Serum 30ml
137,13334,2023-04-27,yeppeuda,820,https://yeppeuda.mk/p/469/cotton-hair-towel,Cotton hair towel
138,13356,2023-04-27,yeppeuda,740,https://yeppeuda.mk/p/486/bust-firming-serum-100ml-for-mom,BUST FIRMING SERUM 100ML FOR MOM
139,12609,2023-04-27,coslovemetics,1267,https://coslovemetics.mk/product/pyunkang-yul-moisture-soothing-sun-cream-spf50-pa-75-ml/,Pyunkang Yul Moisture Soothing Sun Cream SPF50+ PA++++ 75 ml
140,12977,2023-04-27,coslovemetics,431,https://coslovemetics.mk/product/fluff-shower-gel-peach-and-grapefruit-500ml/,Fluff Shower gel Peach and Grapefruit 500ml
141,13243,2023-04-27,yeppeuda,510,https://yeppeuda.mk/p/442/marshmallow-shower-gel-300-ml,Marshmallow shower gel 300 ml
142,13006,2023-04-27,coslovemetics,747,https://coslovemetics.mk/product/farm-stay-24k-gold-peptide-perfect-ampoule-cream-80-ml/,FARM STAY 24K Gold & Peptide Perfect Ampoule Cream 80 ml
143,12882,2023-04-27,coslovemetics,824,https://coslovemetics.mk/product/eyenlip-cica-blemish-clear-cream-50g/,EYENLIP CICA BLEMISH CLEAR CREAM 50g
144,12839,2023-04-27,coslovemetics,657,https://coslovemetics.mk/product/tonymoly-pandas-dream-white-sleeping-pack-50g/,Tonymoly Panda’s Dream White Sleeping pack 50g
145,13003,2023-04-27,coslovemetics,1791,https://coslovemetics.mk/product/laneige-water-sleeping-mask-ex-70ml/,Laneige Water Sleeping Mask EX 70ml
146,13359,2023-04-27,yeppeuda,870,https://yeppeuda.mk/p/483/stretch-mark-serum-100ml-for-mom,STRETCH MARK SERUM 100ML FOR MOM
147,13036,2023-04-27,yeppeuda,1060,https://yeppeuda.mk/p/332/tiam-hyaluronic-water-plumping-serum,TIA'M - Hyaluronic Water Plumping Serum
148,13063,2023-04-27,coslovemetics,1152,https://coslovemetics.mk/product/benton-snail-bee-high-content-essence-100ml/,BENTON SNAIL BEE HIGH CONTENT ESSENCE 100ml
149,13110,2023-04-27,coslovemetics,760,https://coslovemetics.mk/product/geekgorgeous-hydration-station-50ml/,Geek&Gorgeous Hydration Station 50ml
150,13043,2023-04-27,yeppeuda,920,https://yeppeuda.mk/p/141/snail-azulene-water-essence-180ml,Snail & Azulene Water Essence 180ml
151,13044,2023-04-27,coslovemetics,1224,https://coslovemetics.mk/product/tiam-vita-a-anti-wrinkle-moisturizer-80ml/,TIAM Vita A Anti-Wrinkle Moisturizer 80ml
152,13033,2023-04-27,coslovemetics,611,https://coslovemetics.mk/product/tiam-blackhead-out-sheet-35-%d1%82%d1%83%d1%84%d0%b5%d1%80%d0%b8/,TIAM Blackhead Out Sheet 35 туфери
153,13338,2023-04-27,yeppeuda,570,https://yeppeuda.mk/p/385/hot-oil-treatment-for-high-porosity-hair-100ml,Hot oil treatment for high porosity hair 100ml
154,13017,2023-04-27,coslovemetics,492,https://coslovemetics.mk/product/farm-stay-daily-perfume-body-lotion-escargot-330ml/,FARM STAY Daily Perfume Body Lotion Escargot 330ml
155,13191,2023-04-27,yeppeuda,620,https://yeppeuda.mk/p/175/haruharu-wonder-black-bamboo-mist-mini,Haruharu WONDER - Black Bamboo Mist MINI
156,12577,2023-04-27,coslovemetics,690,https://coslovemetics.mk/product/cp-1-premium-silk-ampoule-150ml/,CP-1 Premium Silk Ampoule 150ml
157,13177,2023-04-27,coslovemetics,549,https://coslovemetics.mk/product/enough-collagen-moisture-essential-cream-50ml/,ENOUGH Collagen moisture essential cream 50ml
158,13332,2023-04-27,yeppeuda,820,https://yeppeuda.mk/p/475/moisturizing-body-lotion-for-kids-and-babies,Moisturizing body lotion for kids and babies
159,13374,2023-04-27,yeppeuda,420,https://yeppeuda.mk/p/363/stop-soothing-gel-after-insect-bites-50-ml-floslek,STOP Soothing gel after insect bites - 50 ml - Floslek
160,12878,2023-04-27,coslovemetics,53,https://coslovemetics.mk/product/eyenlip-super-food-mask-tart-cherry-1pcs/,EYENLIP Super Food Mask Tart Cherry 1pcs
161,12580,2023-04-27,coslovemetics,1690,https://coslovemetics.mk/product/cp-1-bright-complex-intense-nourishing-conditioner-500ml/,CP-1 Bright Complex Intense Nourishing Conditioner 500ml
162,12841,2023-04-27,coslovemetics,899,https://coslovemetics.mk/product/tonymoly-wonder-ceramide-mocchi-toner-500ml/,Tonymoly Wonder Ceramide Mocchi Toner 500ml
163,13098,2023-04-27,coslovemetics,989,https://coslovemetics.mk/product/iunik-vitamin-hyaluronic-acid-vitalizing-toner-200ml/,iUNIK Vitamin Hyaluronic Acid Vitalizing Toner 200ml
164,13099,2023-04-27,coslovemetics,1350,https://coslovemetics.mk/product/geekgorgeous-a-game-10-0-1-retinal-serum-28ml/,Geek&Gorgeous A-Game 10 0.1% Retinal Serum 30ml
