,productId,date,seller,price,link,name
323,12647,2023-04-27,coslovemetics,1073,https://coslovemetics.mk/product/cosrx-full-fit-propolis-honey-overnight-mask-60ml/,COSRX Full Fit Propolis Honey Overnight Mask 60ml
324,12943,2023-04-27,coslovemetics,589,https://coslovemetics.mk/product/unleashia-pretty-easy-glitter-stick-n5-dusk/,Unleashia Pretty Easy Glitter Stick N°5 Dusk
325,12739,2023-04-27,coslovemetics,1522,https://coslovemetics.mk/product/missha-signature-wrinkle-filler-bb-cream-spf37-pa-21-44ml/,Missha Signature Wrinkle Filler BB Cream SPF37 PA++ 21 44ml
326,13324,2023-04-27,yeppeuda,582,https://yeppeuda.mk/p/195/vitamin-c-15-30ml,VITAMIN C 15% 30ML
327,13373,2023-04-27,yeppeuda,2490,https://yeppeuda.mk/p/104/dr-jart-cicapair-sleepair-ampoule-in-mask-110ml,Dr. Jart+ - Cicapair Sleepair Ampoule-In Masк 110ml
328,12662,2023-04-27,coslovemetics,1080,https://coslovemetics.mk/product/cosrx-pure-fit-cica-toner-150ml/,COSRX Pure Fit Cica Toner 150ml
329,13329,2023-04-27,yeppeuda,419,https://yeppeuda.mk/p/490/baby-nappy-cream-50ml,BABY Nappy Cream 50ml
330,12631,2023-04-27,coslovemetics,1352,https://coslovemetics.mk/product/cosrx-shield-fit-all-green-comfort-sun-spf50-pa-50ml/,COSRX Shield fit All Green Comfort Sun SPF50+ PA+++ 50ml
331,12822,2023-04-27,coslovemetics,986,https://coslovemetics.mk/product/some-by-mi-snail-truecica-miracle-repair-cream-60gr/,Some by mi Snail TRUECICA Miracle Repair Cream 60gr
332,13002,2023-04-27,coslovemetics,261,https://coslovemetics.mk/product/laneige-multi-deep-clean-cleanser-30ml/,Laneige Multi Deep Clean Cleanser 30ml
333,12769,2023-04-27,coslovemetics,903,https://coslovemetics.mk/product/purito-breeze-water-gel-cream-80-ml/,PURITO Breeze Water Gel Cream 80 ml
334,12872,2023-04-27,coslovemetics,599,https://coslovemetics.mk/product/eyenlip-super-aqua-moisture-cream-45ml/,EYENLIP SUPER AQUA MOISTURE CREAM 45ml
335,13215,2023-04-27,coslovemetics,1044,https://coslovemetics.mk/product/one-thing-niacinamide-10-150ml/,One Thing NIACINAMIDE 10% 150ml
336,12893,2023-04-27,yeppeuda,740,https://yeppeuda.mk/p/354/frudia-tone-up-base-sun-cream-spf50-50gr,FRUDIA TONE-UP BASE SUN CREAM SPF50+ 50GR
337,13258,2023-04-27,yeppeuda,690,https://yeppeuda.mk/p/407/anti-acne-face-toner-100ml,Anti acne face toner 100ml
338,12672,2023-04-27,coslovemetics,466,https://coslovemetics.mk/product/marymay-cica-tea-tree-soothing-wash-off-pack-30g/,Mary&May CICA Tea Tree Soothing Wash off Pack 30g
339,12719,2023-04-27,coslovemetics,1216,https://coslovemetics.mk/product/isntree-hyaluronic-acid-watery-sun-gel-spf-50-pa/,Isntree Hyaluronic Acid Watery Sun Gel SPF 50+/PA++++
340,12962,2023-04-27,coslovemetics,431,https://coslovemetics.mk/product/fluff-body-sorbet-summer-pinacolada-150ml/,Fluff Body Sorbet Summer Pinacolada 150ml
341,12675,2023-04-27,coslovemetics,1040,https://coslovemetics.mk/product/marymay-vitamine-c-bifida-lotion-120ml/,Mary&May Vitamine C + Bifida Lotion 120ml
342,13195,2023-04-27,coslovemetics,922,https://coslovemetics.mk/product/altruist-anti-redness-pigmentation-spf50-50ml/,Altruist Anti-Redness & Pigmentation SPF50 50ml
343,13125,2023-04-27,coslovemetics,510,https://coslovemetics.mk/product/innisfree-no-sebum-mineral-powder-5-gr/,Innisfree No Sebum Mineral Powder 5 gr
344,13188,2023-04-27,coslovemetics,1163,https://coslovemetics.mk/product/haruharu-wonder-black-rice-moisture-deep-cleansing-oil-150-ml/,Haruharu Wonder Black Rice Moisture Deep Cleansing Oil 150 ml
345,12579,2023-04-27,coslovemetics,1390,https://coslovemetics.mk/product/cp-1-head-spa-scalp-scaler-250ml/,CP-1 Head Spa Scalp Scaler 250ml
346,13392,2023-04-27,yeppeuda,799,https://yeppeuda.mk/p/146/heimish-kit,Heimish KIT
347,12894,2023-04-27,coslovemetics,522,https://coslovemetics.mk/product/frudia-ultra-uv-shield-sun-essence-spf50-pa-50g/,Frudia Ultra UV Shield Sun Essence SPF50+/PA++++ 50g
348,13138,2023-04-27,coslovemetics,359,https://coslovemetics.mk/product/etude-house-dear-darling-water-gel-tint-ice-cream-rd306-shark-red-4-5g/,ETUDE HOUSE Dear Darling Water Gel Tint Ice Cream RD308 Straweberry Crunch4.5g
349,12941,2023-04-27,coslovemetics,589,https://coslovemetics.mk/product/unleashia-pretty-easy-glitter-stick-n2-flutter/,Unleashia Pretty Easy Glitter Stick N°2 Flutter
350,13094,2023-04-27,coslovemetics,644,https://coslovemetics.mk/product/iunik-rose-galactomyces-silky-tone-up-cream-40ml/,iUNIK Rose Galactomyces Silky Tone Up Cream 40ml
351,12608,2023-04-27,coslovemetics,3272,https://coslovemetics.mk/product/pyunkang-yul-moisture-set-essence-toner-200ml-moisture-serum-100ml-nutrition-cream-100ml/,Pyunkang Yul Moisture Set Essence Toner 200ml + Moisture Serum 100ml +Nutrition Cream 100ml
352,12816,2023-04-27,coslovemetics,1341,https://coslovemetics.mk/product/some-by-mi-propolis-b5-glow-barrier-calming-mask-100gr/,SOME BY MI Propolis B5 Glow Barrier Calming Mask 100gr
353,13145,2023-04-27,coslovemetics,801,https://coslovemetics.mk/product/etude-house-sunprise-mild-watery-light-spf50-pa-50ml/,ETUDE HOUSE Sunprise Mild Watery Light SPF50+/PA+++ 50ml
354,12938,2023-04-27,coslovemetics,1381,https://coslovemetics.mk/product/unleashia-glitterpedia-eye-palette-n6-all-of-citrus/,Unleashia Glitterpedia Eye Palette N°6 All of Citrus
355,12789,2023-04-27,coslovemetics,341,https://coslovemetics.mk/product/purito-centella-unscented-recovery-cream-mini-12ml/,PURITO Centella Unscented Recovery Cream (mini) 12ml
356,13028,2023-04-27,yeppeuda,890,https://yeppeuda.mk/p/80/ac-fighting-aha-bha-pha-toner,AC Fighting AHA BHA PHA Toner
357,12824,2023-04-27,coslovemetics,1031,https://coslovemetics.mk/product/some-by-mi-snail-truecica-miracle-repair-serum-50-ml/,Some by mi Snail TRUECICA Miracle Repair Serum 50 ml
358,12855,2023-04-27,coslovemetics,629,https://coslovemetics.mk/product/eyenlip-calamansi-whitening-cream-50ml/,EYENLIP CALAMANSI WHITENING CREAM 50ml
359,12664,2023-04-27,coslovemetics,466,https://coslovemetics.mk/product/marymay-blackberry-complex-glow-wash-off-pack-30g/,Mary&May Blackberry Complex Glow Wash off Pack 30g
360,12891,2023-04-27,coslovemetics,737,https://coslovemetics.mk/product/eyenlip-kombucha-enriched-balm-cream-50ml/,EYENLIP KOMBUCHA ENRICHED BALM CREAM 50ml
361,12710,2023-04-27,coslovemetics,1071,https://coslovemetics.mk/product/beauty-of-joseon-radiance-cleansing-balm-100ml/,Beauty of Joseon RENEW Radiance Cleansing Balm 100ml
362,13382,2023-04-27,yeppeuda,999,https://yeppeuda.mk/p/322/dermo-expert-anti-acne-normalizing-acid-peel-night-care-30-ml,DERMO EXPERT® ANTI ACNE Normalizing acid peel night care - 30 ml
363,13045,2023-04-27,yeppeuda,1190,https://yeppeuda.mk/p/402/tiam-vita-a-bakuchiol-firming-eye-cream-30ml,Tiam Vita A Bakuchiol Firming Eye Cream 30ml
364,12950,2023-04-27,coslovemetics,564,https://coslovemetics.mk/product/unleashia-get-loose-glitter-gel-n4-love-dreamer/,Unleashia Get Loose Glitter Gel N°4 Love Dreamer
365,12794,2023-04-27,coslovemetics,688,https://coslovemetics.mk/product/purito-cica-clearing-bb-cream-spf-38-pa-light-beige-21/,PURITO Cica Clearing BB Cream SPF 38/PA+++ Light Beige 21
366,12952,2023-04-27,coslovemetics,564,https://coslovemetics.mk/product/unleashia-get-loose-glitter-gel-n6-sunset-lover/,Unleashia Get Loose Glitter Gel N°6 Sunset Lover
367,13256,2023-04-27,yeppeuda,720,https://yeppeuda.mk/p/409/spot-treatment-cream-30ml,Spot treatment cream 30ml
368,12835,2023-04-27,coslovemetics,1240,https://coslovemetics.mk/product/b5glowsbm/,SОME BY MI Propolis B5 glow Barrier Calming serum 50ml
369,13129,2023-04-27,yeppeuda,1190,https://yeppeuda.mk/p/361/tocobo-cotton-soft-sun-stick-spf50-pa,TOCOBO COTTON SOFT SUN STICK SPF50+ PA+++
370,12921,2023-04-27,coslovemetics,564,https://coslovemetics.mk/product/unleashia-hug-velvet-tint-n3-share/,Unleashia Hug Velvet Tint N°3 Share
371,13049,2023-04-27,yeppeuda,690,https://yeppeuda.mk/p/130/vitamine-blending-powder,Vitamine Blending Powder
372,12940,2023-04-27,coslovemetics,589,https://coslovemetics.mk/product/unleashia-pretty-easy-glitter-stick-n1-thrilled/,Unleashia Pretty Easy Glitter Stick N°1 Thrilled
373,12948,2023-04-27,coslovemetics,564,https://coslovemetics.mk/product/unleashia-get-loose-glitter-gel-n2-starlit-chaser/,Unleashia Get Loose Glitter Gel N°2 Starlit Chaser
374,12763,2023-04-27,coslovemetics,998,https://coslovemetics.mk/product/heimish-all-clean-balm-120ml/,Heimish All Clean Balm 120ml
375,13053,2023-04-27,coslovemetics,1083,https://coslovemetics.mk/product/benton-aloe-propolis-soothing-gel-100ml/,BENTON Aloe Propolis Soothing Gel 100ml
376,13024,2023-04-27,coslovemetics,59,https://coslovemetics.mk/product/farm-stay-visible-difference-mask-sheet-acerola-23-ml/,FARM STAY Visible Difference Mask Sheet Acerola 23 ml
377,13117,2023-04-27,coslovemetics,1155,https://coslovemetics.mk/product/innisfree-anti-aging-serum-sunscreen-40ml/,Innisfree Anti-aging Serum Sunscreen 40ml
378,13191,2023-04-27,coslovemetics,792,https://coslovemetics.mk/product/haruharu-wonder-black-rice-serum-30ml/,HaruHaru Wonder Black Rice Serum 30ml
379,13101,2023-04-27,coslovemetics,790,https://coslovemetics.mk/product/geekgorgeous-apad-20-azeclair-serum-30ml/,Geek&Gorgeous aPAD 20% Azeclair Serum 30ml
380,13322,2023-04-27,yeppeuda,860,https://yeppeuda.mk/p/197/peptides-10-30-ml,PEPTIDES 10% 30 ML
381,13056,2023-04-27,coslovemetics,104,https://coslovemetics.mk/product/benton-aloe-soothing-mask-pack-1-%d0%bf%d0%b0%d1%80%d1%87%d0%b5/,BENTON Aloe Soothing Mask Pack 1 парче
382,13301,2023-04-27,yeppeuda,670,https://yeppeuda.mk/p/259/body-scrub-sweet-honey-wafers-200gr,Body scrub - Sweet honey wafers 200gr
383,13254,2023-04-27,yeppeuda,1099,https://yeppeuda.mk/p/411/retinol-body-cream-150ml,Retinol body cream 150ml
384,12614,2023-04-27,coslovemetics,1832,https://coslovemetics.mk/product/pyunkang-yul-skin-set-low-ph-pore-deep-cleansing-foam-40-ml-essence-toner-100ml-intensive-repair-cream-50ml/,Pyunkang Yul Skin Set Low PH Pore Deep Cleansing Foam 40 ml + Essence Toner 100ml + Intensive Repair Cream 50ml
385,12915,2023-04-27,coslovemetics,564,https://coslovemetics.mk/product/unleashia-non-sticky-dazzle-tint-n1-blink/,Unleashia Non Sticky Dazzle Tint N°1 Blink
386,12984,2023-04-27,coslovemetics,599,https://coslovemetics.mk/product/fluff-turmeric-and-vitamin-c-booster-two-phase-face-serum-40ml/,Fluff Turmeric and vitamin C Booster/Two-phase Face Serum 40ml
387,12998,2023-04-27,coslovemetics,1791,https://coslovemetics.mk/product/laneige-cica-sleeping-mask/,Laneige Cica Sleeping Mask
388,13041,2023-04-27,yeppeuda,820,https://yeppeuda.mk/p/142/snail-azulene-low-ph-cleanser,Snail & Azulene Low pH Cleanser
389,13189,2023-04-27,yeppeuda,890,https://yeppeuda.mk/p/173/haruharu-wonder-black-rice-hyaluronic-cream-mini,Haruharu WONDER - Black Rice Hyaluronic Cream MINI
390,12602,2023-04-27,coslovemetics,152,https://coslovemetics.mk/product/pyunkang-yul-low-ph-pore-deep-cleansing-foam-40ml/,Pyunkang Yul Low Ph Pore Deep Cleansing Foam 40ml
391,12599,2023-04-27,coslovemetics,208,https://coslovemetics.mk/product/pyunkang-yul-essence-toner-30ml-mini/,Pyunkang Yul Essence Toner 30ml MINI
392,12880,2023-04-27,coslovemetics,269,https://coslovemetics.mk/product/eyenlip-ceramide-cica-cleansing-foam-100ml/,EYENLIP CERAMIDE CICA CLEANSING FOAM 100ml
393,12773,2023-04-27,coslovemetics,1197,https://coslovemetics.mk/product/purito-centella-green-level-recovery-cream/,PURITO Centella Green Level Recovery Cream
394,12856,2023-04-27,coslovemetics,759,https://coslovemetics.mk/product/eyenlip-centella-skin-resurrection-cream-50ml/,EYENLIP Centella Skin Resurrection Cream 50ml
395,13164,2023-04-27,coslovemetics,649,https://coslovemetics.mk/product/axis-y-the-mini-glow-set/,AXIS-Y The Mini Glow Set
396,13047,2023-04-27,yeppeuda,1260,https://yeppeuda.mk/p/246/tiam-vita-b3-mist-toner-200ml,TIA'M - Vita B3 Mist Toner 200ml
397,13146,2023-04-27,coslovemetics,837,https://coslovemetics.mk/product/etude-house-sunprise-mild-airy-finish-spf50-pa-55ml/,Etude House Sunprise Mild Airy Finish SPF50+/PA+++ 55ml
398,12956,2023-04-27,coslovemetics,615,https://coslovemetics.mk/product/fluff-anti-cellulite-body-serum-100g/,Fluff Anti-cellulite Body Serum 100g
399,13300,2023-04-27,yeppeuda,665,https://yeppeuda.mk/p/261/face-cleansing-foam-avocado-150ml,Face Cleansing Foam avocado 150ml
400,13112,2023-04-27,coslovemetics,590,https://coslovemetics.mk/product/geekgorgeous-liquid-hydration-5-panthenol-nmf-toner-110-ml/,Geek&Gorgeous Liquid Hydration 5% Panthenol + NMF Toner 110 ml
401,12869,2023-04-27,coslovemetics,599,https://coslovemetics.mk/product/eyenlip-pure-perfection-natural-sun-cream-50g/,EYENLIP PURE PERFECTION NATURAL SUN CREAM 50g
402,13134,2023-04-27,coslovemetics,254,https://coslovemetics.mk/product/etude-house-lash-perm-curl-fix-eyelash-curler/,Etude House Lash Perm Curl Fix eyelash curler
403,12800,2023-04-27,coslovemetics,1522,https://coslovemetics.mk/product/some-by-me-aha-bha-pha-miracle-calming-body-lotion-200ml/,Some By Me AHA BHA PHA MIRACLE CALMING BODY LOTION 200ml
404,13147,2023-04-27,coslovemetics,891,https://coslovemetics.mk/product/etude-house-soonjung-mild-defense-sun-cream-50ml-spf49-pa/,Etude House Soonjung Mild Defense Sun Cream 50ml SPF49 PA++
405,12889,2023-04-27,coslovemetics,829,https://coslovemetics.mk/product/eyenlip-f8-v12-vitamin-moisture-cream-50g/,EYENLIP F8 V12 VITAMIN MOISTURE CREAM 50g
406,13371,2023-04-27,yeppeuda,2280,https://yeppeuda.mk/p/168/dr-jart-cicapair-calming-gel-cream-80ml,Dr. Jart+ - Cicapair Calming Gel Cream 80ml
407,12702,2023-04-27,coslovemetics,143,https://coslovemetics.mk/product/beauty-of-joseon-centella-asiatica-calming-mask-1ea/,Beauty of Joseon Centella Asiatica Calming Mask 1ea
408,12893,2023-04-27,coslovemetics,522,https://coslovemetics.mk/product/frudia-tone-up-base-sun-cream-spf50-pa-50gr/,Frudia Tone-Up Base Sun Cream SPF50+ PA+++ 50gr
409,13385,2023-04-27,yeppeuda,999,https://yeppeuda.mk/p/318/sun-care-sun-protection-tinted-cream-spf-50-dry-and-sensitive-skin-50-ml,SUN CARE Sun Protection Tinted Cream SPF 50+ dry and sensitive skin - 50 ml
410,12992,2023-04-27,coslovemetics,719,https://coslovemetics.mk/product/fluff-face-milk-raspberry-nourishing-40ml/,Fluff Face Milk Raspberry Nourishing 40ml
411,13018,2023-04-27,coslovemetics,526,https://coslovemetics.mk/product/farm-stay-grape-stem-cell-wrinkle-lifting-cream-50ml/,FARM STAY Grape Stem Cell Wrinkle Lifting Cream 50ml
412,12933,2023-04-27,coslovemetics,1381,https://coslovemetics.mk/product/unleashia-glitterpedia-eye-palette-n1-all-of-glitter/,Unleashia Glitterpedia Eye Palette N°1 All of Glitter
413,13348,2023-04-27,yeppeuda,840,https://yeppeuda.mk/p/374/protein-mask-for-medium-porosity-hair-200-ml,Protein mask for medium porosity hair 200 ml
414,12655,2023-04-27,yeppeuda,790,https://yeppeuda.mk/p/434/cosrx-low-ph-good-morning-gel-cleanser-150ml,COSRX - Low pH Good Morning Gel Cleanser 150ml
415,12753,2023-04-27,coslovemetics,1087,https://coslovemetics.mk/product/heimish-watermelon-moisture-soothing-gel-cream-110ml/,Heimish Watermelon Moisture Soothing Gel Cream 110ml
416,12657,2023-04-27,coslovemetics,552,https://coslovemetics.mk/product/cosrx-master-patch-intensive-36pcs/,COSRX Master Patch Intensive 36pcs
417,13354,2023-04-27,yeppeuda,680,https://yeppeuda.mk/p/488/intimate-cleansing-foam-150ml-for-mom,INTIMATE CLEANSING FOAM 150ML FOR MOM
418,13227,2023-04-27,yeppeuda,820,https://yeppeuda.mk/p/475/moisturizing-body-lotion-for-kids-and-babies,Moisturizing body lotion for kids and babies
419,12757,2023-04-27,coslovemetics,639,https://coslovemetics.mk/product/heimish-all-clean-mini-kit-%d0%b2%d0%b5%d1%80%d0%b7%d0%b8%d1%98%d0%b0-1/,Heimish All Clean Mini Kit верзија 1
420,12965,2023-04-27,coslovemetics,683,https://coslovemetics.mk/product/fluff-cleansing-face-mousse-wild-berries-50ml/,Fluff Cleansing Face Mousse Wild Berries 50ml
421,13341,2023-04-27,yeppeuda,620,https://yeppeuda.mk/p/382/scalp-serum-100ml,Scalp Serum 100ml
422,13313,2023-04-27,yeppeuda,740,https://yeppeuda.mk/p/206/hyaluronic-acid-10-30-ml,HYALURONIC ACID 10% 30 ML
423,12688,2023-04-27,coslovemetics,1040,https://coslovemetics.mk/product/marymay-vitamine-b5-bifida-toner-120ml/,Mary&May Vitamine B5 + Bifida Toner 120ml
424,13189,2023-04-27,coslovemetics,792,https://coslovemetics.mk/product/haruharu-black-rice-hyaluronic-cream-50ml/,HaruHaru Black Rice Hyaluronic Cream 50ml
425,13088,2023-04-27,coslovemetics,621,https://coslovemetics.mk/product/iunik-lime-moisture-mild-peeling-gel-120ml/,iUNIK Lime Moisture Mild Peeling Gel 120ml
426,13248,2023-04-27,yeppeuda,590,https://yeppeuda.mk/p/418/niacinamide-face-cleansing-gel-150ml,Niacinamide Face Cleansing Gel 150ml
427,12583,2023-04-27,coslovemetics,1006,https://coslovemetics.mk/product/pyunkang-yul-ato-cream-blue-label-120ml/,Pyunkang yul ATO Cream Blue Label 120ml
428,12620,2023-04-27,coslovemetics,257,https://coslovemetics.mk/product/cosrx-acne-pimple-master-24-patches/,COSRX Acne Pimple Master 24 patches
429,12731,2023-04-27,coslovemetics,128,https://coslovemetics.mk/product/missha-mascure-whitening-solution-sheet-mask-glutathione-28ml-1pc/,Missha Mascure Whitening Solution Sheet Mask – Glutathione 28ml – 1pc
430,13148,2023-04-27,coslovemetics,1125,https://coslovemetics.mk/product/etude-house-soonjung-hydro-barrier-cream-75ml/,Etude House Soonjung Hydro Barrier Cream 75ml
431,12778,2023-04-27,coslovemetics,1008,https://coslovemetics.mk/product/purito-dermide-cica-barrier-sleeping-pack-80ml/,PURITO Dermide Cica Barrier Sleeping Pack 80ml
432,13029,2023-04-27,yeppeuda,1260,https://yeppeuda.mk/p/127/ac-fighting-oil-free-aqua-cream-80ml,AC Fighting Oil-Free Aqua Cream 80мл
433,12865,2023-04-27,coslovemetics,400,https://coslovemetics.mk/product/eyenlip-peptide-dew-ampoule-30g/,EYENLIP PEPTIDE DEW Ampoule 30g
434,12812,2023-04-27,coslovemetics,850,https://coslovemetics.mk/product/some-by-mi-bye-bye-blackhead-30-days-miracle-green-tea-tox-bubble-cleanser-120gr/,Some by mi BYE BYE BLACKHEAD 30 days Miracle Green Tea Tox Bubble Cleanser 120gr
435,13037,2023-04-27,yeppeuda,180,https://yeppeuda.mk/p/289/tiam-my-signature-vita-red-mask-1,TIA'M - My Signature Vita Red Mask 1
436,12832,2023-04-27,coslovemetics,772,https://coslovemetics.mk/product/some-by-mi-yuja-niacin-brightening-moisture-gel-cream-100ml/,SOME BY MI Yuja Niacin Brightening Moisture Gel Cream 100ml
437,12919,2023-04-27,coslovemetics,564,https://coslovemetics.mk/product/unleashia-hug-velvet-tint-n1-be-with/,Unleashia Hug Velvet Tint N°1 Be With
438,12735,2023-04-27,coslovemetics,1012,https://coslovemetics.mk/product/missha-perfect-covering-bb-cream-no-27-honey-beige-50ml/,Missha Perfect Covering BB Cream No.27 Honey Beige 50ml
439,13103,2023-04-27,coslovemetics,200,https://coslovemetics.mk/product/geekgorgeous-c-glow-mini-bottle/,Geek&Gorgeous C-Glow Mini Bottle
440,12598,2023-04-27,coslovemetics,843,https://coslovemetics.mk/product/pyunkang-yul-essence-toner-200ml/,Pyunkang Yul Essence Toner 200ml
441,13166,2023-04-27,coslovemetics,699,https://coslovemetics.mk/product/surmedic-azulene-soothing-ph-cleanser-150ml/,Surmedic+ Azulene Soothing pH Cleanser 150ml
442,13268,2023-04-27,yeppeuda,690,https://yeppeuda.mk/p/390/moisturizing-face-cream-with-a-filter-spf-50-pa-50-ml,Moisturizing face cream with a filter - SPF 50 PA ++++ - 50 ml
443,13361,2023-04-27,yeppeuda,760,https://yeppeuda.mk/p/481/moisturizing-shampoo-to-prevent-tangling-of-hair-250ml-for-kids,MOISTURIZING SHAMPOO TO PREVENT TANGLING OF HAIR 250ML FOR KIDS
444,13040,2023-04-27,coslovemetics,1161,https://coslovemetics.mk/product/tiam-pore-minimizing-21-serum-40ml/,TIAM Pore Minimizing 21 Serum 40ml
445,13238,2023-04-27,yeppeuda,860,https://yeppeuda.mk/p/457/face-and-body-photostable-cream-for-baby-spf-50-50-ml,Face and body photostable cream for baby SPF 50 50 ml
446,12591,2023-04-27,coslovemetics,680,https://coslovemetics.mk/product/pyunkang-yul-calming-moisture-mist-100ml/,PYUNKANG YUL Calming Moisture Mist 100ml
447,12654,2023-04-27,coslovemetics,772,https://coslovemetics.mk/product/cosrx-hydrium-triple-hyaluronic-moisture-cleanser-150ml/,COSRX Hydrium Triple Hyaluronic Moisture Cleanser 150ml
448,13178,2023-04-27,coslovemetics,286,https://coslovemetics.mk/product/enough-collagen-moisture-essential-mist-100ml/,ENOUGH Collagen moisture essential mist 100ml
449,13240,2023-04-27,yeppeuda,480,https://yeppeuda.mk/p/445/acid-neutralizer-spray-100-ml,Acid neutralizer spray 100 ml
450,12850,2023-04-27,coslovemetics,539,https://coslovemetics.mk/product/eyenlip-ac-clear-spot-15ml/,EYENLIP AC CLEAR SPOT 15ml
451,13196,2023-04-27,coslovemetics,435,https://coslovemetics.mk/product/altruist-moisturising-fluid-0-5-hyaluronic-acid-50ml/,Altruist Moisturising Fluid 0.5% Hyaluronic Acid 50ml
452,12730,2023-04-27,coslovemetics,128,https://coslovemetics.mk/product/missha-mascure-rescue-solution-sheet-mask-madecassoside-28ml-1pc/,Missha Mascure Rescue Solution Sheet Mask – Madecassoside 28ml – 1pc
453,12875,2023-04-27,coslovemetics,249,https://coslovemetics.mk/product/eyenlip-super-food-hand-cream-100ml-orange-basil/,EYENLIP Super Food Hand Cream 100ml Orange & Basil
454,12629,2023-04-27,coslovemetics,952,https://coslovemetics.mk/product/cosrx-refresh-abc-daily-toner-aha-bha-vitamin-c-150ml/,Cosrx Refresh ABC Daily Toner (AHA BHA Vitamin C) 150ml
455,13130,2023-04-27,yeppeuda,1190,https://yeppeuda.mk/p/360/tocobo-bio-watery-sun-cream-spf50-pa,TOCOBO BIO WATERY SUN CREAM SPF50+ PA+++
456,13082,2023-04-27,coslovemetics,945,https://coslovemetics.mk/product/iunik-black-snail-restore-serum-50ml/,iUNIK Black Snail Restore Serum 50ml
457,13319,2023-04-27,yeppeuda,525,https://yeppeuda.mk/p/200/retinol-025-30ml,Retinol 0.25% 30ml
458,13086,2023-04-27,coslovemetics,719,https://coslovemetics.mk/product/iunik-centella-calming-gel-cream-60ml/,iUNIK Centella Calming Gel Cream 60ml
459,13169,2023-04-27,coslovemetics,553,https://coslovemetics.mk/product/skinfood-rice-mask-wash-off-100g/,Skinfood Rice Mask Wash Off 100g
460,12784,2023-04-27,coslovemetics,1473,https://coslovemetics.mk/product/purito-oat-in-intense-cream-150ml/,PURITO Oat-in Intense Cream 150ml
461,12910,2023-04-27,coslovemetics,716,https://coslovemetics.mk/product/unleashia-shaper-pomade-eyebrow-fixer-n1-clear/,Unleashia Shaper Pomade Eyebrow Fixer N°1 Clear
462,12966,2023-04-27,coslovemetics,584,https://coslovemetics.mk/product/fluff-make-up-removing-balm-wild-berries-50ml/,Fluff Make Up Removing Balm Wild Berries 50ml
463,12925,2023-04-27,coslovemetics,552,https://coslovemetics.mk/product/unleashia-minest307-concealer-brush/,Unleashia MINEST307 CONCEALER BRUSH
464,12859,2023-04-27,coslovemetics,719,https://coslovemetics.mk/product/eyenlip-centella-skin-resurrection-toner-150ml/,EYENLIP Centella Skin Resurrection Toner 150ml
465,13085,2023-04-27,coslovemetics,891,https://coslovemetics.mk/product/iunik-centella-calming-daily-sunscreen-spf-50-pa-60ml/,iUNIK Centella Calming Daily Sunscreen SPF 50+ PA++++ 60ml
466,13162,2023-04-27,coslovemetics,1299,https://coslovemetics.mk/product/axis-y-mugwort-pore-clarifying-wash-off-pack-100ml/,AXIS-Y Mugwort Pore Clarifying Wash Off Pack 100ml
467,13137,2023-04-27,coslovemetics,359,https://coslovemetics.mk/product/etude-house-dear-darling-water-gel-tint-ice-cream-or205-apricot-red-4-5g/,ETUDE HOUSE Dear Darling Water Gel Tint Ice Cream OR205 Apricot Red 4.5g
468,13007,2023-04-27,coslovemetics,416,https://coslovemetics.mk/product/farm-stay-aloevera-perfect-sun-cream-spf50-pa-70g/,FARM STAY Aloevera Perfect Sun Cream SPF50+ PA+++ 70g
469,13021,2023-04-27,coslovemetics,59,https://coslovemetics.mk/product/farm-stay-real-coconut-essence-mask-23-ml/,FARM STAY Real Coconut Essence Mask 23 ml
470,13172,2023-04-27,coslovemetics,383,https://coslovemetics.mk/product/double-dare-omg-hair-band-black/,Double Dare OMG! Hair Band Black
471,13328,2023-04-27,yeppeuda,460,https://yeppeuda.mk/p/491/moisturizing-face-cream-for-kids-babies-50-ml,MOISTURIZING FACE CREAM FOR KIDS - BABIES 50 ML
472,12700,2023-04-27,coslovemetics,1005,https://coslovemetics.mk/product/marymay-niacinamide-chaenomeles-sinensis-serum-30ml/,Mary&May Niacinamide + Chaenomeles Sinensis Serum 30ml
473,12990,2023-04-27,coslovemetics,719,https://coslovemetics.mk/product/fluff-face-milk-green-tea-mattifying-40ml/,Fluff Face Milk Green Tea Mattifying 40ml
474,12760,2023-04-27,coslovemetics,438,https://coslovemetics.mk/product/heimish-all-clean-balm-50ml/,Heimish All Clean Balm 50ml
475,12797,2023-04-27,coslovemetics,1044,https://coslovemetics.mk/product/purito-daily-go-to-sunscreen-spf50-pa-60ml/,PURITO Daily Go-To Sunscreen SPF50 PA++++ 60ml
476,12920,2023-04-27,coslovemetics,564,https://coslovemetics.mk/product/unleashia-hug-velvet-tint-n2-mingle/,Unleashia Hug Velvet Tint N°2 Mingle
477,12916,2023-04-27,coslovemetics,564,https://coslovemetics.mk/product/unleashia-non-sticky-dazzle-tint-n2-sunbeam/,Unleashia Non Sticky Dazzle Tint N°2 Sunbeam
478,12712,2023-04-27,coslovemetics,855,https://coslovemetics.mk/product/beauty-of-joseon-revive-eye-serum-ginseng-retinal-30ml/,Beauty of Joseon Revive Eye Serum: Ginseng + Retinal 30ml
479,12947,2023-04-27,coslovemetics,564,https://coslovemetics.mk/product/unleashia-get-loose-glitter-gel-n1-aurora-catcher/,Unleashia Get Loose Glitter Gel N°1 Aurora Catcher
480,12975,2023-04-27,coslovemetics,431,https://coslovemetics.mk/product/fluff-shower-gel-cucumber-and-green-tea-500ml/,Fluff Shower gel Cucumber and green tea 500ml
481,12741,2023-04-27,coslovemetics,2032,https://coslovemetics.mk/product/missha-time-revolution-night-repair-probio-ampoule-serum-50ml/,Missha Time Revolution Night Repair Probio Ampoule Serum 50ml
482,13198,2023-04-27,coslovemetics,649,https://coslovemetics.mk/product/altruist-sunscreen-face-fluid-spf50-50ml/,Altruist Sunscreen Face Fluid SPF50 50ml
483,12699,2023-04-27,coslovemetics,1005,https://coslovemetics.mk/product/marymay-multi-hyaluronics-serum-30ml/,Mary&May Multi Hyaluronics Serum 30ml
